titre,date,description,lien,journal,annee
L’hebdomadaire antisémite « Rivarol » au bord de la faillite,"Fri, 13 Jun 2025 15:00:00 +0200","Titre historique de l’extrême droite d’après-guerre, le journal dirigé par Jérôme Bourbon pourrait prochainement fermer boutique, trois ans après le retrait de son agrément par la Commission paritaire des publications et agences de presse.",https://www.lemonde.fr/politique/article/2025/06/13/l-hebdomadaire-antisemite-rivarol-au-bord-de-la-faillite_6612733_823448.html,www.lemonde.fr,2025.0
"En Espagne, une constellation poreuse d’influenceurs-journalistes au service de l’extrême droite","Thu, 12 Jun 2025 05:00:03 +0200","« L’essor des médias réactionnaires en Europe ». Au Congrès, des agitateurs politiques, munis d’une carte de presse en raison de leur collaboration avec des médias de droite radicale, provoquent les députés de gauche afin de fabriquer des contenus viraux qu’ils diffusent ensuite sur leurs réseaux sociaux.",https://www.lemonde.fr/economie/article/2025/06/12/en-espagne-une-constellation-poreuse-d-influenceurs-journalistes-au-service-de-l-extreme-droite_6612414_3234.html,www.lemonde.fr,2025.0
"Aux Pays-Bas, la chaîne ON ! est soutenue par des dirigeants d’extrême droite","Wed, 11 Jun 2025 14:30:03 +0200","« L’essor des médias réactionnaires en Europe ». Créée en 2009, cette chaîne se fait l’écho des thèmes des deux formations d’extrême droite : rejet de l’immigration, critique de l’Union européenne et climatoscepticisme.",https://www.lemonde.fr/economie/article/2025/06/11/aux-pays-bas-la-chaine-on-est-soutenue-par-des-dirigeants-d-extreme-droite_6612217_3234.html,www.lemonde.fr,2025.0
"En Pologne, une galaxie de médias ultraconservateurs au service de l’extrême droite","Tue, 10 Jun 2025 16:30:08 +0200","« L’essor des médias réactionnaires en Europe ». Dans ce pays d’Europe de l’Est, une variété d’hebdomadaires, de quotidiens, de radios et de télévisions entretiennent des accointances à peine voilées avec les organisations politiques de la droite la plus dure.",https://www.lemonde.fr/economie/article/2025/06/10/en-pologne-une-galaxie-de-medias-ultraconservateurs-au-service-de-l-extreme-droite_6612064_3234.html,www.lemonde.fr,2025.0
"Louis Sarkozy, Napo baby","Tue, 13 May 2025 13:35:00 +0000","Admirateur de Napoléon, le fils de l’ancien président se multiplie dans les médias et rêve de se forger un destin politique à droite.",https://www.liberation.fr/portraits/louis-sarkozy-napo-baby-20250513_5VUVA2MV35FKXERQLITUEPSPSE/,www.liberation.fr,2025.0
"Et si l’extrême droite et la tech étaient bien plus que des compagnons de route ? Une contre-histoire de la Silicon Valley, avec Sylvie Laurent","Sat, 14 Jun 2025 18:47:05 +0200","Dans son passionnant « la Contre-Révolution californienne », l’américaniste retrace l’histoire méconnue des affinités électives entre « révolution » numérique et « révolution » reaganienne, nées en Californie.",https://www.nouvelobs.com/idees/20250614.OBS104948/et-si-l-extreme-droite-et-la-tech-etaient-bien-plus-que-des-compagnons-de-route-une-contre-histoire-de-la-silicon-valley-avec-sylvie-laurent.html,www.nouvelobs.com,2025.0
« Si vous tirez la conclusion que je suis un nazi...  » : la parole sans filtre des sans-grade du groupe d’ultradroite AFO,"Sat, 14 Jun 2025 08:30:06 +0200","Seize militants du groupe Action des Forces opérationnelles (AFO) sont jugés depuis le début de la semaine au tribunal correctionnel de Paris. Ces retraités, qui comparaissent libres, se dépeignent comme des « patriotes » engagés mais inoffensifs.",https://www.nouvelobs.com/justice/20250614.OBS104924/si-vous-tirez-la-conclusion-que-je-suis-un-nazi-la-parole-sans-filtre-des-sans-grade-du-groupe-d-ultradroite-afo.html,www.nouvelobs.com,2025.0
"« Hey les amigos, je peux jouer avec vous ? » : mission secrète dans un groupe d’ultradroite","Thu, 12 Jun 2025 17:41:11 +0200","Notre chroniqueur est en mission  : il doit se faire passer pour un jeune étudiant en droit dans une association étudiante d’extrême droite nommée la Bannière. Plusieurs problèmes se posent, dont un : son âge.",https://www.nouvelobs.com/chroniques/20250612.OBS104877/hey-les-amigos-je-peux-jouer-avec-vous-mission-secrete-dans-un-groupe-d-ultradroite.html,www.nouvelobs.com,2025.0
« Toute parole de haine raciste porte en elle la promesse d’un crime » : l’appel d’une centaine de personnalités contre la dégradation du débat public,"Thu, 12 Jun 2025 13:13:47 +0200","Après un nouvel attentat raciste, qui a coûté la vie à Hichem Miraoui à Puget-sur-Argens, à l’initiative de SOS Racisme, 98 responsables associatifs, syndicalistes, universitaires et artistes exhortent les responsables politiques à cesser de courir après l’extrême droite et l’Etat français à lutter réellement contre le racisme et l’antisémitisme",https://www.nouvelobs.com/societe/20250611.OBS104830/toute-parole-de-haine-raciste-porte-en-elle-la-promesse-d-un-crime-l-appel-d-une-centaine-de-personnalites-contre-la-degradation-du-debat-public.html,www.nouvelobs.com,2025.0
"Dans le Loiret, le RN réunit ses alliés européens et espère se relancer","Tue, 10 Jun 2025 15:56:55 +0200","Les partis d’extrême droite du groupe Patriotes pour l’Europe étaient conviés à se rassembler, ce lundi 9 juin, à l’invitation du Rassemblement national. Le parti ne parvient pas à faire taire les rumeurs sur des tensions entre Marine Le Pen et Jordan Bardella.",https://www.nouvelobs.com/politique/20250609.OBS104763/dans-le-loiret-le-rn-reunit-ses-allies-europeens-et-espere-se-relancer.html,www.nouvelobs.com,2025.0
Qu’est-ce que le catholicisme social ?,"Sun, 15 Jun 2025 10:00:00 +0000","Qu’est-ce que le catholicisme social ?
hschlegel
dim 15/06/2025 - 12:00

En savoir plus sur Qu’est-ce que le catholicisme social ?

Depuis sa prise de fonction, le pape Léon XIV suscite la curiosité : quelle est sa vision du monde ? En tête des discussions, le choix de son nom, qui remonte à Léon XIII, célèbre pour avoir rédigé l’encyclique Rerum novarum en 1891. Cette encyclique trouve sa source dans un courant au XIXe siècle : le catholicisme social. Enquête.[CTA2]C’est une notion qui regagne en actualité. En toile de fond de l’élection du pape Léon XIV resurgit une doctrine issue du XIXe siècle, dont Robert Francis Prevost – le nom du pape au civil – serait l’un des représentants : le catholicisme social. Et c’est dans les racines du nom qu’il s’est choisi en tant que Souverain pontife qu’il faut puiser. Car le nom qu’un pape se donne est bien loin d’être anodin. En 2013, Jorge Mario Bergoglio prend la décision de se nommer François, en hommage à saint François d’Assise, fondateur de l’ordre des franciscains connu pour sa philosophie du dénuement. Le nom du nouveau chef de l’Église catholique, lui, renvoie à Léon XIII, pape de 1878 à 1903. C’est lui qui va faire passer à la postérité la « doctrine sociale de l’Église » à travers l’encyclique Rerum novarum de 1891.Une origine traditionalisteDans les années 1830-1840, des débats émergent au sein de l’Église sur la question sociale. Avec l’émergence de la révolution industrielle, la condition ouvrière commence à prendre de l’importance. Pour Denis Pelletier, historien spécialiste du catholicisme à l’École pratique des hautes études (EPHE), une inquiétude générale saisit les élites françaises. La question sociale est prise à bras-le-corps et quelque chose que l’on n’appelle pas encore catholicisme social commence à apparaître. Au cours de cette période, différents mouvements se forment en dehors de l’Église, parmi lesquels un fort courant légitimiste – et donc monarchiste – qui se crée en réaction au capitalisme. Il faut garder à l’esprit que les balbutiements du catholicisme social traversent l’ensemble du spectre politique de l’époque, des traditionalistes aux socialistes en passant par les libéraux. Mais les traditionalistes occupent une place fondamentale dans la propagation du catholicisme social, car l’Église est farouchement hostile au libéralisme et au socialisme. Aussi contre-intuitif que cela puisse paraître, ils font montre de plus de présence et d’activité que les chrétiens de gauche, minoritaires. Parmi les traditionalistes, on retrouve des personnages pionniers comme René de La Tour du Pin, Léon Harmel ou Albert de Mun. Homme politique et académicien, Albert de Mun s’impose, à droite, comme l’un des tenants d’une ligne sociale. Il est le fondateur de l’Œuvre des cercles catholiques d’ouvriers, une association créée en 1871. Celle-ci a pour but la rechristianisation de la classe ouvrière et la défense de ses intérêts contre la société capitaliste. Dans Ma vocation sociale. Souvenirs de la fondation de l’Œuvre des cercles catholiques d’ouvriers (1871-1875) (publié en 1908), il résume son engagement. Il est né d’un « réveil » face au « cauchemar » subi au début des années 1870, où se sont déroulés, entre autres, le siège de Paris, la défaite face à la Prusse puis la Commune. À la suite de ces événements, « chacun avait l’impression qu’il renaissait à la vie, et non pas seulement à la vie matérielle, mais à la vie morale, à la vie nationale, à la vie patriotique ». Cette période a été, pour Albert de Mun, le point de départ de la création de son cercle catholique ouvrier.➤ À lire aussi : Léon XIV, portrait philosophique d’un pape en quête d’unitéLe cercle présente son projet à Lyon, en 1874, lors du congrès de l’Union des œuvres ouvrières, créée par des prêtres. « L’Œuvre dont j’entreprends d’exposer ici la monographie a pour fin le dévouement de la classe dirigeante à la classe ouvrière ; – pour principes les définitions de l’Église sur ses rapports avec la société civile – et pour forme le Cercle catholique d’ouvriers », commence son représentant, un certain « T.C. ». Pour lui, la classe élevée, « en abandonnant la tutelle des classes populaires », est responsable du désordre qui s’est emparé d’elle et menace rien de moins que de « ruiner la patrie ». Au lendemain de ce qu’il appelle des « désastres nationaux », il estime que « former des associations » au sein de la classe dirigeante qui soient « vouées au salut » de la classe ouvrière est une pensée qui doit « grandir en plusieurs cœurs ». Il y a bel et bien, à cette époque, un surgissement de la question sociale, dont les catholiques, surtout issus de l’aristocratie et de la bourgeoisie, s’emparent. « Nous ne nous sommes pas engagés dans une œuvre liée à la vie sociale sans être fermement persuadés qu’il existe une doctrine sociale nécessaire et immuable », peut-on lire.Si la question sociale est abondamment monopolisée par des catholiques plutôt traditionalistes, le catholicisme social s’impose également dans les milieux démocrates-chrétiens, voire chez certains socialistes. C’est notamment le cas de Marc Sangnier, qui fonde à la fin du XIXe siècle le mouvement « Le Sillon », qui est d’abord un journal philosophique. Celui-ci vise à rapprocher les catholiques de la République et éloigner les ouvriers de la gauche marxiste et anticléricale. Progressiste, militant pour l’éducation populaire, pour la défense des opprimés et porteur d’un humanisme à tous crins, Sangnier marque d’une trace indélébile son époque et les suivantes. « Il ne faudrait pas que notre soif de justice et notre désir d’égalité nous fissent rêver d’une société froide et desséchée, sans entrailles pour les vaincus de la vie, sans rémission pour les coupables et que n’éclairerait plus le sourire rédempteur de la charité du Christ », peut-on lire dans La Lutte pour la démocratie (1908).Léon XIII et la fondation de la “doctrine sociale de l’Église”En 1891, après des années de ramification de la question sociale, l’Église catholique se positionne à travers un texte fondateur, l’encyclique Rerum novarum [à lire dans son intégralité sur le site du Vatican], rédigée par le pape Léon XIII. Comme l’explique Denis Pelletier, il est « le premier texte du magistère romain qui prend position sur la question sociale ». Selon l’historien, « Rome intervient pour réguler les discussions et non pas pour les fonder ». Dans ce texte fouillé, Léon XIII ouvre l’Église catholique à la modernité et emprunte une troisième voie, entre le socialisme et le libéralisme capitaliste. D’emblée, Léon XIII dénonce « la soif d’innovations qui depuis longtemps s’est emparée des sociétés et les tient dans une agitation fiévreuse ». Il critique vertement les rapports de domination imposés par le système capitaliste et qui pèsent sur les épaules des ouvriers, ainsi que la concentration de l’industrie entre les mains de quelques-uns. Ces « ploutocrates » et « hommes opulents » imposent « un joug presque servile à l’infinie multitude des prolétaires. » Léon XIII fustige également la destruction des corporations anciennes, qui étaient, pour les ouvriers, qu’il appelle la « multitude laissée dans l’indigence », des lieux de protection. Pour pallier ce mal, le chef de l’Église plaide pour « venir en aide aux hommes des classes inférieures, attendu qu’ils sont pour la plupart dans une situation d’infortune et de misère imméritées », tout en regrettant que les sentiments religieux du passé aient disparu des lois et des institutions publiques. Fidèle à l’idée d’une troisième voie, Léon XIII n’épargne pas non plus le socialisme, accusé de vouloir « guérir ce mal » en « poussant à la haine jalouse des pauvres contre les riches ». Autrement dit, la remise en cause de la propriété proposée par les socialistes est « souverainement injuste » car elle « viole » les droits légitimes des propriétaires et trouble en profondeur « l’édifice social ». L’abolition de la propriété privée serait ainsi contraire à l’esprit du catholicisme social réel car elle rendrait les ouvriers plus précaires en leur retirant la « libre disposition de leur salaire ».➤ À lire aussi : Augustin, le philosophe qui inspire Léon XIVPar-delà cette querelle de la propriété privée, il estime, point cardinal de son encyclique, que les patrons « ne doivent point traiter l’ouvrier en esclave ; il est juste qu’ils respectent en lui la dignité de l’homme, relevée encore par celle du chrétien ». Et de conclure que si la société humaine doit être « guérie », elle ne le sera que par le « retour à la vie et aux institutions du christianisme. » C’est ainsi que Rerum novarum, par son attention accordée à la question sociale et aux ouvriers, puis à sa dénonciation du capitalisme libéral et du socialisme, marque les esprits. Surtout, il fonde la « doctrine sociale de l’Église » et lui donne une substance au plus haut niveau. Il ne crée pas le catholicisme social, il l’institutionnalise. Rerum novarum a une postérité extrêmement importante, jusqu’à notre époque. L’encyclique influence des associations, des groupes, des syndicats qui revendiquent une appartenance à la grande famille du catholicisme social. En France, la CFTC (Confédération française des travailleurs chrétiens), créée en 1919, s’en revendique explicitement. Au XXe siècle, le catholicisme social continue son évolution et se greffe à des problématiques plus modernes. Selon Denis Pelletier, il est affecté, dans les années 1940-50, par l’émergence du tiers monde, et dans les années 1950-60 par la question environnementale – qui continue à agiter l’Église et le pape François lors de la rédaction de Laudato si’ en 2015. Signe de la postérité de la doctrine sociale élaborée au XIXe siècle, quarante années après Rerum novarum, le pape Pie XI écrit en 1931 l’encyclique Quadragesimo anno, qui commémore et poursuit les réflexions de Léon XIII. En 2004, la doctrine sociale fait l’objet d’une synthèse avec le Compendium de la doctrine sociale de l’Église, rédigée par le cardinal Martino, président du conseil pontifical Justice et Paix.Et la théologie de la libération ?Mais le catholicisme social est un phénomène très circonscrit et européen. Des mouvements éclosent dans les années 1970 et prennent un pas de côté vis-à-vis du catholicisme social originel. C’est notamment le cas de la « théologie de la libération », qui prend forme en Amérique latine [sur le sujet, lire notre grande fresque sur l’histoire de la « pensée décoloniale », et notre portrait d’Enrique Dussel]. Pour Denis Pelletier, l’idée principale de cette théologie est de « penser la question théologique à partir de l’injustice sociale dans les pays du Sud ». Si la théologie de la libération n’est rien de moins qu’un courant, une variante du catholicisme social, l’historien explique que celle-ci marque quand même une rupture. En effet, elle tente de s’éloigner de ce dernier, jugé trop « conservateur ». Alors que le catholicisme social a été théorisé par une majeure partie de traditionalistes, la théologie de la libération mêle christianisme et marxisme et lutte contre l’oppression, sous quelque forme que ce soit (économique, militaire ou policière). Pour certains, le pape François s’inscrivait dans le sillage de la théologie de la libération, lui qui était critique du néolibéralisme, de l’oppression, et portait une attention particulière aux opprimés, d’où qu’ils viennent.La filiation avec Léon XIVEt Léon XIV, dans tout ça ? Avec le nouveau chef de l’Église catholique, le catholicisme social théorisé au XIXe siècle semble revenir sur le devant de la scène. La filiation avec Léon XIII et son encyclique Rerum novarum est assumée, revendiquée, et permet d’asseoir la base doctrinale de son futur pontificat. Dans un discours prononcé le 16 mai dernier, Léon XIV s’ancre véritablement dans le sillage de Léon XIII. « Poursuivre la paix exige de pratiquer la justice. Comme je l’ai déjà évoqué, j’ai choisi mon nom en pensant avant tout à Léon XIII, le pape de la première grande encyclique sociale », Rerum novarum, avance-t-il. Et il ajoute :“Dans le changement d’époque que nous vivons, le Saint-Siège ne peut s’empêcher de faire entendre sa voix face aux nombreux déséquilibres et injustices qui conduisent, entre autres, à des conditions de travail indignes et à des sociétés de plus en plus fragmentées et conflictuelles. Il faut également s’efforcer de remédier aux inégalités mondiales, qui voient l’opulence et la misère creuser des fossés profonds entre les continents, entre les pays et même au sein d’une société”Pape Léon XIV, discours du 16 mai 2025 aux membres du Corps diplomatique accrédité près le Saint-SiègeAvec Léon XIV, l’Église semble s’être choisie un pape unificateur, progressiste, qui lutte contre les oppressions et fait valoir les principes d’une doctrine sociale forgée deux siècles plus tôt. Si le nouveau pape semble arborer une vision légèrement plus conservatrice que son prédécesseur (mosette rouge traditionnelle, étole dorée…), éloignée du dénuement le plus extrême des franciscains, il n’en reste pas moins attentif à la misère d’autrui, au point d’en faire l’axe principal de son pontificat. La communauté catholique jugera sur pièces. Affaire à suivre.

 


juin 2025",https://www.philomag.com/articles/quest-ce-que-le-catholicisme-social,www.philomag.com,2025.0
"Bac philo 2025, l’ultime conseil : comment surmonter sa peur de l’épreuve ?","Fri, 13 Jun 2025 13:00:00 +0000","Bac philo 2025, l’ultime conseil : comment surmonter sa peur de l’épreuve ? 
hschlegel
ven 13/06/2025 - 15:00

En savoir plus sur Bac philo 2025, l’ultime conseil : comment surmonter sa peur de l’épreuve ? 

Alors que l’épreuve tant redoutée du bac philo (c’est lundi 16 juin !) approche à grands pas, difficile de ne pas se laisser envahir par la peur. Mais difficile n’est pas impossible ! Nous vous proposons donc, avec le philosophe Alain, de remplacer la peur par le passage à l’action et le plaisir du jeu.[CTA2] L’épreuve du baccalauréat de philosophie a lieu le lundi 16 juin. Et si c’était l’occasion idéale d’apprendre à déjouer la peur du grand saut ? Le philosophe français Alain (1868-1951), de son vrai nom Émile-Auguste Chartier, charismatique professeur de khâgne au lycée Henri-IV à Paris de 1909 à 1933 et connu pour ses chroniques journalistiques (il était un peu l’ancêtre de Philomag…), est le philosophe idéal pour nous accompagner dans la dernière ligne droite.La peur de l’épreuveLes « peurs sans mesure à l’approche d’un discours public ou d’un examen » qu’évoque le philosophe doivent certainement résonner chez les candidats qui s’apprêtent à passer le Grand Oral et l’examen de philosophie. Mais ce sont bien des « peurs sans mesure », car elles portent sur des « maux imaginaires », dont les dangers ne sont pas réels, ni tangibles, ni nettement identifiés. Ces « maux imaginaires » s’opposent aux « maux véritables » que sont la maladie, le deuil, la perte, la guerre… Le rôle de la philosophie n’est alors pas d’éradiquer la peur de l’épreuve mais de la tenir à distance. Comment ? En révélant tout ce que la peur a d’imaginaire, d’infondé et d’illusoire. « La peur est proprement l’attente d’on ne sait quelle action que l’on va avoir à faire », écrit Alain dans Quatre-vingt-un chapitres sur l’esprit et les passions (1916). Elle correspond à l’attente qui précède l’action. Mais « la peur se nourrit d’elle-même », au sens où « l’incertitude et l’hésitation l’aggravent ». Elle est un cercle vicieux, où l’individu n’appréhende l’épreuve qu’à travers des biais cognitifs fatalistes (« de tout façon, je n’y arriverai pas ») ou nihilistes (« à quoi bon ? »). Paralysé par la peur, on en cherche la cause, on entre dans des boucles de spéculation infinies, on réécrit une énième fois le scénario dans notre tête pour venir à bout de cette action future dont on ne sait rien… en vain. Pire, « le raisonnement », pourtant cher à la philosophie, « ne peut rien ». Voilà qui n’est pas très rassurant…Tactique n°1 : passer à l’actionSoyez rassurés : Alain préconise le passage à l’action productive pour mettre fin aux sursauts de peur. « L’action délivre de cette maladie », affirme le professeur de philosophie. Son conseil ? Effectuer « de petites actions assez difficiles et que l’on sait bien faire ». Subdiviser l’action finale (composer une copie de philosophie en quatre heures) en petites actions efficaces (relire ses cours, consulter les aides à la révision de Philosophie magazine, s’entraîner sur un sujet à l’aide des annales). Résultat : « on est aussitôt soulagé ». Comment l’expliquer ? Pour Alain, ces petites actions ont la vertu de nous occuper et ainsi de ne plus être dans l’attente, car « l’attente de la peur, c’est la peur même ». L’objet de notre vigilance est alors utilement dévié vers des tâches qui sont à notre portée, canalisant notre peur et provoquant une détente quasi-immédiate.Tactique n°2 : se prendre au jeuIl y a une seconde tactique : aborder l’épreuve de philosophie comme vous aborderiez un jeu. Le livre de notre philosophe-pédagogue renferme en effet un autre trésor de sagesse. Il nous invite à ne pas sous-estimer la puissance de la « passion du jeu », alimentée par « un désir de gagner mieux nourri que les désirs ordinaires ».Quels sont les intérêts à se prendre au jeu ? Éloigner la peur : dans le jeu, pas de danger réel, seulement de la difficulté. Être déterminé à vaincre : vaincre de la difficulté posée par le texte ou la question philosophique peut avoir des allures de combat. Renoncer à choisir entre le stress moteur et le stress paralysant, qui ont leur origine dans une peur néfaste de l’épreuve. Le jeu implique de la détente sans pour autant sacrifier le sérieux. Avoir en tête les règles du jeu à tout moment : muni d’un stylo et de papier, vous avez quatre heures pour réfléchir à des notions philosophiques.Rappelons-nous que le but de l’épreuve n’est pas de nous faire souffrir mais de nous faire réfléchir. Au lieu de penser que la question s’adresse à un programme de connaissances que nous aurions accumulées dans l’année, il faut se dire que la question nous est adressée personnellement, qu’elle vaut la peine d’être posée. Alain soulignait la force juvénile qui se déploie dans la pensée : « Chez les jeunes surtout, l’esprit est prompt à penser de nouveau le monde véritable et toute la vie. » Tout un programme…Notre conseil, donc : jouez le jeu !

 


juin 2025",https://www.philomag.com/articles/bac-philo-2025-lultime-conseil-comment-surmonter-sa-peur-de-lepreuve,www.philomag.com,2025.0
