mot,citation
alambiqué,"Le langage de l’Anglais dénote une connaissance approfondie du cœur et de la vie ; celui du Français brille d’un éclat léger, pimpant, éphémère ; l’Allemand rumine longtemps une phrase alambiquée dont le sens échappe à bien des gens ; […]."
alambiqué,"[…] Sébastien Chambot […] qui récolte des paquets de billets de mille avec des romans alambiqués et voluptueux, où il n’est question que de tortillements de la viande humaine saturée de cantharide."
alambiqué,"La narration, pour limpide qu'elle soit dans certaines pages superbes, vagabonde souvent dans des méandres où elle risque de perdre bien des lecteurs – d'autant plus que le style, empli de poésie, tend parfois à devenir alambiqué et exige une attention particulièrement vigilante."
alambiqué,"Il chercha la page des jeux, plus précisément celle où se trouvaient les mots fléchés qu'il préférait aux mots croisés, ces derniers comportaient parfois des définitions alambiquées, voire tarabiscotées et qui ne tenaient qu'à un fil."
alambiqué,"Elle-même défend une formule alambiquée de « partenariat douanier » dans lequel le Royaume-Uni percevrait les droits de douane pour le compte de l’UE, mais verserait une ristourne lorsque les biens demeurent sur le sol britannique."
