,tweets
35204,"aujourd'hui, je le sens le plus proche jamais ... iglobyoudoggy ... merci pour vos mots, votre temps, pour cet amour et ce 3 ans! 30.dcm"
35240,"playster.org changera bientot pour etre playster.org ce que je veux dire, nous allons bientot etre un moteur de recherche pour les evenements. nous esperons que vous aimez."
35337,"le ciel etait assez fin nite, je suis tombe, il avait l'air si paisible. & matthardybrand: hai inclus les deux mots ..."
35426,assis ici en jouant avec final cut express et souhaitant etre au camp de mots
35833,"a essaye de lire un crime et une punition, mais les mots sur la page continuent de bouger! dormir. bonjour"
35875,"vous ne devez pas etre alarme, juste un bavardage d'idoles !! hahahahaha, je leur aime les jeux de mots!"
35927,je me sens tres emotif au mo
35983,merci! je travaille sur 2 mots de mots de colonne en ce moment - je ne peux pas vraiment le mettre dans google docs tho
36374,"non, je ne suis pas desireux de faire internet sans un civil! j'ai eu un mot de passe freakin d'autres ids! lazim civil je les accompagnerais"
36980,"si vous echangez le mot conservateur pour republicain, je serai d'accord"
37092,"les dessins animes, etc. sont-ils bientot des avatars atavitiques? (oui, j'ai toujours voulu utiliser ces 2 mots dans 1 phrase"
37183,"vous etes les lignes de ma chanson, les mots qui me font chanter. alors, qu'est-ce qui se passe quand vous etes parti? est-ce que je me trouverais encore chanter?"
37550,je le revise et mon compte de mots diminue alors que je supprime les <<jugements de valeur>> que je pense etre plutot bons
37778,ajoutez simplement un lien cliquable comme je l'ai fait sur votre page promotionnelle
37818,"je me suis senti entierement & quot; meh & quot; les derniers jours ... ce qui est dommage, car c'est vraiment sympa, mais je ne peux pas me motiver"
38081,gah. c'est un mot qui decrit comment je me sens trop bien si
38305,"eveille, et ne l'aime pas vraiment. mais depuis mon depart, on dirait maintenant que je vais dejeuner le petit-dejeuner et lire le mot <<fml>>. des choses amusantes la-bas."
38507,"a etudie le francais. a etudie l'histoire. ugh est le seul mot sur lequel je peux penser maintenant, mais ... la vie est bonne =]"
38726,assis dans son lit. se sentent emotionnellement et physiquement crappy. j'ai envie de pleurer
38857,quelqu'un peut-il me motiver? ma famille est idk
38878,"c'est un petit mot cependant. seulement un 125. maintenant, si c'etait un 600, je serais d'accord."
38885,je suis ravi de l'edition kindle. kindle commence a rendre la lecture cool a nouveau! merci pour les mots d'encouragement!
39024,"j'ai perdu ma voix, il ne faut que parler de mots visibles maintenant: /"
39066,"des mots de la personne la plus drole ... ""je suis fatigue, mes skis sont trop serres, et ma tete est hurtin de gauche a droite! & quot; baahahaaa! ..."
39096,mes parfums preferes sont lilas et amp; lavender.parparate ou ensemble. mmmmmmm. tellement rafraichissant. def my mother child
39257,"eh bien, j'ai juste besoin de me motiver, et aussi, faire mes devoirs et mes essais ... et ... c'est une belle journee! comment?"
39536,ouvre son dictionnaire allemand depuis 2 ans environ ... c'est incroyable combien de mots j'ai perdu ...
39925,open office & quot; writer & quot; est bizarre. j'ai besoin d'un mot pour ouvrir correctement les mots
39936,"il y a 2 hivers, j'ai casse 2 cotes et me frappe le rein sur ma motoneige, donc, plus je pense a ca, je n'ai pas appris."
40118,"j'ai juste essaye de faire les devoirs, j'ai abandonne avant d'ecrire un mot"
40412,eeeeeeeeeee suis tellement content de me demander ce qui se passera si son torquay v c'bridge en finale de promotion! c'bdge sera comme nous!
40598,"je suis a la maison, je monge mon hahaha moto loh, c'est genial"
40703,"haha yah, ce sera un amusement fou et un mot, j'aimerais etre comme le peche, alors tous les garcons peuvent aussi m'aimer"
40769,"regarder un ami s'auto-detruire physiquement, emotionnellement et, mentalement, il doit etre le pire jamais parce que vous ne pouvez pas soupirer"
41490,"paris!!!!! je veux bien etre mon bff !!! mais ils donnent le public au spectacle, ils sont tous des promoteurs ... paris !! je veux te rencontrer"
41605,elles sont! j'ai connu les mots depuis que la chanson est sortie jeune homme. ajoute-toi au jeu janet;) ca te va bien. surtout maintenant
41642,vous dirait d'ecrire environ 7 facons d'etre motive a ecrire.
41950,a besoin d'une nouvelle planche a roulettes! car le mien a juste eu des roues motrices! le boulon s'est detache et le camion qui se detache en cas de chute de la colline!
41989,"je suis sur ce stupide train unique, je ne pouvais meme pas avoir un double decka booooo j'aimerais etre la, damnit mothers day lol"
42096,pas de motivation je dois faire du travail a la pelouse
42120,"maigreur, c'est un nouveau mot pour decrire comment on se sent le lendemain d'une migraine!"
42233,"films & amp; telechargements! les mots plus doux n'ont jamais ete parle ... ou? j'ai aussi un lien, mais les films ont des sous-ensembles"
42301,"les grandes nouvelles ont eu un sommet sur une nouvelle affiche promotionnelle. il a dit ""le nouvel iphone: plus grand, badder, & amp; plus rapide que jamais aucune photo n'est permise"
42323,"un mot pour resumer aujourd'hui - oh wow, ce n'est meme pas un mot sanglant."
42375,... ferraillera le marathon du film au lit tellement ennuye mais se sent un peu mieux. je deteste les limites des mots.
43121,"heh, j'essaye juste de faire ma part pour faire passer le mot! mais non, je n'ai pas ete dehors aujourd'hui, tous les appels de service"
43336,"semble bien, mais je n'aime pas abandonner mon mot de passe twitter pour rejoindre"
43350,"vous vaut la peine de perdre l'estime de soi, vos mots intelligents ne signifient rien pour moi plus qu'une ligne que j'ai entendue dans un film."
43575,repandez le mot et dites aux gens de me suivre s'il vous plait!
43602,le gars qui joue ben franklin a eu un coup! les rapports disent qu'il est de bonne humeur mais aucun mot sur les competences motrices
43631,"un mot: aeroporte. j'adore ces choses petillantes. de plus, tu te lave les mains ... je ne m'inquieterais pas. amusez-vous bien! scaphandre autonome?"
43760,"je sais, il y a quelques films kiddie auxquels j'aime beaucoup regarder et connaitre les mots."
43839,"fuck land, je suis sur un bateau motherfucka, baiser des arbres, je grimpe des bouees motherfucka"
44208,essayer de me motiver ... toute aide?
44315,"lol. en aucune facon! tu es incroyable! je suis celui qui cannae, mais ca va bien. l'emotion nous fera passer ;-) hahaha x"
44402,"priez pour mon frere michael. il a 20 ans, toujours en coma pendant un mois sur un ventilateur apres un accident de moto ..."
44409,je me couche ici dans un lit emotif et tres malade.
44661,"j'aimerais avoir des idees ou des suggestions, mais je suis en perte de mots. c'est triste d'entendre!"
44739,wordpress a besoin de 2 arrets de lecture avec mes emoticones. pour de vrai. aucun d'entre eux n'est apparu.
44812,chers forces de securite: vous avez besoin de nouvelles motos. je te regarde dans le coin de la rue la-bas
44832,et j'ai 16 ans & amp; je me souviens de ce livre quand j'etais le petit moteur qui pouvait. je pense que je peux donc pouvoir le faire !!!
44995,"est venu a travers cela aujourd'hui, proverbes 12: 15-16 ... mot! comptant mes benedictions"
45088,"accueil du motocross, jour etrange, ennuyeux comme les gens malades"
45238,- le mot de la parole sort du gateau - joyeux bday foo !!!!
45396,"oh, allez-y pour la panne, bebe. nous sommes des adultes - nous pouvons le gerer, utilisez simplement * s pour masquer les mots de jure;)"
45463,je garde toujours quelques sacs de vetements maigres en tant que motivation.
45472,"j'aime l'accent de nicky hayden ... trop mignon. ooops, retour a regarder le jeu ... * ahem * sidetracked by motogp doco"
45611,"portant le vert, mais il y a 60% de chance de t-storm l'apres-midi = pas de moto pour travailler"
45732,wanger banger est un mot de myyyyyy! vous ne le prenez pas! c'est a moi! il m'a fallu beaucoup de temps pour penser a ce mot!
45889,"mes coups de sang ont apparemment tue une litiere de chiots de marmotte, et cela me rend triste"
45919,le remede pour le mot h
45926,"j'ai appris quelques mots, je peux jurer comme un marin italien ivre! les grands-parents pouvaient parler anglais."
45983,je ne perdrai pas ces mots. je vais les ecrire tous pour vous.
46117,l'un des inconvenients de la surveillance des blogs pour certains mots cles est que tout le monde ne dit pas de bonnes choses.
46453,"cela ressemblait a un jeu de mots, je suppose que ce n'etait pas"
46518,"il y a une femme sur notre vol qui pourrait facilement utiliser 2 sieges, elle me motive a ne jamais manger a nouveau."
46519,j'aime etre inspire ... il se fait sentir dans l'esprit n motive-reinitialiser mes idees n preferences apres le decalage et le decollage ... les bebes sortent!
46870,vraiment ne pas creuser le voisin voisin qui semble tourner au hasard un moteur vraiment fort. je * vraiment * je veux ouvrir les fenetres aussi
47249,je voudrais un camaro de 69 ss avec un moteur de chasseur
47312,"se livrer a un mot, la vapeur en direct semble trop compliquee - faire face a dcc est amusant"
47567,mot sans crainte du jour
47586,les gens sont-ils vraiment prets a payer 100 $ pour un contexte? www.twitterimage.com/ hmmm ... je vais faire un motif de kick ** pour 25 $ et un cooky!
47976,"cela prendra plus de 140! en un mot, deux entites tres differentes."
48585,i & lt; 3 entreprises qui realisent reellement des <<promotions speciales>> de twitter.
48618,pense a se debarrasser de la moto. l'analyse cout-benefice ne fonctionne pas.
48650,"oh, dommage! je manque la celebration mtv de la promotion et les celebrites qui se debrouillent. triste fucking break"
48959,"ok, je vais essayer de ne pas vous repondre lorsque vous dormez comme si vous avez desesperement besoin de dormir! vous ecris vos mots"
49005,"j'ai enseigne le mot ""chat"" a 17 personnes aujourd'hui. yay! je devrais etre un enseignant."
49205,"j'apprecie certainement ,,, et pour m'aider a repandre des mots d'illumination"
49229,assurez-vous que le lemme twitpic. mon mari est un fan de tete de moteur et amp; cela me donnera des points avec lui.
49268,vos reves sont devenus realite! j'ai besoin de quelques mots de sagesse ... pouvez-vous me suivre?
49366,juste regarde la qualification de motogp ... tout simplement saisissante! excellents resultats - attendons avec impatience les courses demain
49533,"mon mot, mon internet semble etre beaucoup mieux aujourd'hui woopie !!!!!!!"
49673,j'ai compris 1 mot. boston.
49728,"les fans de donnie europe ont besoin d'un show.only show !!!! ou seulement des mots de vous !! nous avons besoin de nouveaux enfants sur le bloc en automne, nous vous manquons"
49873,le hoquet emotionnel: les pires choses et je les deteste au noyau
