,tweets
2273,une matinee grossiere. . boire des boissons energisantes de maniere responsable. . je ne pouvais pas dormir pour la vie de moi. . uugg doit reussir cette journee.
2335,je peux entendre les voisins homosexuels faire la fete et j'aimerais vraiment aller a une fete de danse ce soir panda triste pour etre responsable
3679,- mon chateau de sable que mon pere a detruit!
3790,argh! bloque hors de son propre serveur! souhaite que le gars responsable de l'entretien du domaine ait declare les personnes avant qu'il ne commence a faire des choses bizarres a l'annonce
6220,et laisse nos plages de sable derriere le hehe
6988,"je ne pense pas que votre contact iranien connaisse vraiment l'histoire nazie, mais c'est excusable ..."
9140,"retweet joyeux jour des peres a tous les peres responsables. toute ma compagnie est partie pour le week-end, donc c'est de retour a la campagne"
10542,d'accord. il est indispensable de s'inscrire maintenant. au revoir! oh et bonne nuit
13442,"la pluie, le sable et les enfants ne se melangent pas! je suis tellement present sur cette pluie et sooooo ne veut pas avoir une aiguille en 25 minutes"
14449,"homme doux, tu fais des chateaux de sable"
16517,je veux ralentir la danse avec david archuleta par les sables oceaniques la nuit avec les etoiles qui nous regardent ...
17647,etre crie parce que je ne suis pas responsable
17853,"les emplois de steve sont comme un empereur, mysterieux et insaisissable. nous avons trop de niveaux de securite et je suis comme un soldat a pied."
17901,"- en tant qu'educateur, les caisses ou drogues fkd sont sans stress - totalement irresponsables et ont une memoire extremement rapide"
18112,d'accord 10 minutes supplementaires de repos b4 j'ai 2 mis mes contacts. mes paupieres se sentent encore doux avec du papier sable
19208,"fait une soupe de tomate et un sable au fromage grille pour mon bebe malade, maintenant, pour obtenir son vicks vapore de la vapeur, elle ne peut pas cesser de tousser"
21342,"est-ce que vous etes indispensable, de toute facon"
22806,vous pouvez toujours pretendre faire des pommes de terre ecrasees pour aller avec du sable
22863,"ahh, je ne sais pas! je ne m'echappe pas, mais vraiment, je ne le sais pas. pour moi, c'est un thingie indefinissable ... il ne faut pas avoir une definition"
24750,"ne me permettez pas d'etre obsede, quel que soit le responsable de mes actions, vous avez fait un si mauvais travail ces derniers temps"
25439,"il y avait une pile entiere de fromage comment ont-ils reussi 2 a manger tout? tout ce que je veux, c'est un putain de sable! mayb, je vais prendre une chance a mcdonalds"
25707,"je ne peux pas acceder aux objets utilisables ou aux sorts dans la bataille ... aide! nom d'animal de compagnie: happysquash, cela m'a deja perdu deux boss bosses."
26284,aller au banc de sable avec karson! sanams la nuit derniere en utah! triste
26956,"lol, je detesterais etre responsable de ca! pas de dispute, je vais au lit, meme les enfants sont alles au lit tot ... etrange mais bon"
29416,qui dit 2 qu'il ne partira pas sans avis? et essayer d'eviter de prendre le stimulant indispensable pour les ecoles? mal
30385,je suppose qu'il a un certain charme des annees 80. je serais personnellement responsable du telephone 8 pistes motorola. j'aime beaucoup mes telephones
31280,"darn it! je viens d'avoir ete bloque par notre responsable de chat en train de discuter en utilisant un site de discussion illegal (imo.im). au revoir, demain, il pourrait bloquer ..."
34892,"oh bien, en avant !!!!! (a un moment donne dans un futur proche, je pense que je serai responsable de la mise en service !!!! juste pour changer un peu les choses)."
35372,"fille, si vous etiez la tournee, je serais serieusement le premier responsable des billets. juste disant."
37379,"a ete pris sous la pluie. la mousson de sable tout le chemin de la maison, meme si je ressemblais a un idiot complet"
39498,est-ce que lorna ecoute de la musique et attend le p. nk indispensable! p! nk en 6 jours yay !!!!!
39844,oh. mon. dieu. c'est ridiculement inexcusable. avaient fini. tellement triste pour la masse et l'ampli mon fave cerione
40620,"oh wow ... jolie, jolies fleurs! quelle facon de sabler samedi matin!"
42300,elle est a nouveau responsable.
43140,"lol, je ne peux pas attendre pour la pratique, des studios de baisse dans torrance w / insaisissable! & lt; 33"
46031,"donc, les pilotes sont tellement responsables et ils ne peuvent pas se defendre & gt; quelque chose pour lequel nous nous habituons, malheureusement"
47631,"en effet, l'alternative est impensable"
49559,"bien sur, mon pere m'a simplement appele irresponsable. salut, je sais."
