,tweets
0,motorcycledaily editor & quot; unchained & quot; pensees sur le zero s. assez vendu sur electrique. predit ~ 50% d'electricite d'ici 2020
169,"le frere a encore 96 neons, mais le moteur a detruit le tranny. la voiture a ete assis pendant 2 ans. il ne me laissera pas l'acheter"
189,merci pour tous les enonciations de motivation johan
194,nous avons eu un ehr depuis plus de 10 ans. ete une experience. en maintenant nos pratiques md maintenant. les jeunes medecins en font la promotion 4.
289,dolphin bleu avec elaine puis mote
380,"vous n'etes pas serieux, n'est-ce pas? coz mon ami se fait tout en etat d'emotion xx"
469,c'est en fait la marque de veste de moto dont je possede
478,"assis sur mon cul, regarde motocrosse ....... et je veux absolument 2 aller 2 le juste 2nite ......... & lt; 3"
633,"oui, mais mes efforts ont change d'avis @ la derniere minute. je suis vraiment motive 2 go, mais je ne conduis pas, alors si mes developpements ne vont pas, je dnt."
741,3500 mots de plus
851,j'espere que la performance de motte n'est pas une indication de ce qui se passe.
1034,ooops. heureux de ne pas coller le mot de passe de mon compte bancaire!
1445,"ont ecrit depuis 18h00 et amp; j'ai seulement 300 mots. ne peut s'empecher de modifier lorsque j'ecris. arretez-vous, moi-meme! oh, j'ai aussi fait des recherches."
1498,"j'etais plein d'abeille d'abeilles orthographiques. les nerfs ont eu le meilleur de moi, je suis sorti sur & quot; joint & quot; et ""hartering"", mots que je connaissais!"
1571,typepad & quot; editeur riche & quot; mess avec votre html d'une maniere qui rappelle vaguement le mot microsoft.
1601,les vaches pleurent vraiment ce soir. ces creatures emotionnelles. triste
2111,un servomoteur isc pour? voila mon fonds de pc ...
2408,il dit bientot le moteur de service! ca ne peut pas etre bon! oh cher
2614,"toujours en attente de cette heure heureuse, missy !? quel est le mot?"
3019,finis les promotions hebdomadaires pour les 4 prochaines semaines!
3239,"dans une mauvaise humeur, quelqu'un me motive"
3397,"maintenant, je suis sans voix, redondant et triste ... si mal que je ne trouve pas les bons mots pour dire ... je suis vraiment desole ..."
3833,"rapport: deja achete un macbook 13 & quot; aluminium, merci pour vos mots"
3997,"un podcast paien - l'ombre de deo, un podcast d'esprit - braincast, et un formateur spirituel / motivant one-huna"
4080,oh mec. mon ami shayeclubb a perdu un tres bon ami par un accident de moto. tre triste
4165,est-ce que quelqu'un a un chargeur de telephone motorola? ma batterie est presque completement morte
4229,merci beaucoup pour les mots gentils
4325,c'est beaucoup d'emotion a jeun!
4372,je suis monte sur la montagne emotive depuis le 26 janvier 2008 ... mais cette fois ... trop difficile a resoudre.
4784,honteuse auto-promotion. & quot; 3 choses a changer pour obtenir votre ex retour & quot;
4801,mot au sage ... ne jamais avoir une colonoscopie
5012,"non, je vais passer les 2 prochains jours a essayer de me souvenir de mon mot de passe. ca passe mon week-end."
5074,la semaine suivante peut-elle etre emotionnellement stable? je ne peux pas suivre la rehydratation apres plusieurs dysfonctionnements du conduit lacrymogene
5159,vous m'appartiens - la musique dit les mots que nous ne pouvons pas
5268,woo a obtenu quelques mots pour l'examen !! semble bien jusqu'a maintenant
5303,"physiquement, mentalement et emotionnellement draine et epuise mais je n'ai pas pu dormir pendant plusieurs nuits"
5618,je suis cense travailler sur mon livre. . mais je ne suis pas motive. .
6029,je deteste 2k + essais de limite de mots sur les petites choses.
6118,juss est rentre du travail ... les mots cnt expliquent combien je suis fatigue et je parie quand je serai dans mon lit je ne pourrai pas dormir smh ugh
6347,avoir du mal avec la pre-vente ... le mot de passe ne fonctionnerait pas ici
6427,"omg: o pfffft u celebs ont tout le dieu freaking fun, je bavarder juste a la pensee de ce joli & quot; little & quot; moteur: o ...."
6509,"un mot c'est au cours de l'ecole est termine l'ecole secondaire est termine l'examen ont termine, mais en disant que vous faites face a 2 tous les jours est sur ou peut-etre pas;)"
7142,"merveilleuse promotion de cet enregistrement et amp; ca va super bien, je dois venir au royaume-uni avec ca"
7204,oh ... vous ne connaissez pas sa carriere de chanteuse fabuleuse? je veux dire apparemment qu'elle est la merde! et il la fait la promotion. barf!
7213,etre emotionnel est meilleur qu'aucun sentiment tout cela pousse notre vie afin que ce ne soit pas trop fade
7244,mais une evaluation moins encourageante du moteur d'application google
7269,le compte twitter gratuit ne peut pas etre donne a quelqu'un a change le mot de passe
7286,il n'y a rien comme travailler sur votre curriculum vitae ou lettre de motivation tout en jouant mybrute pour les frissons
7458,jus vu un garcon moucher son cyclomoteur
7495,& amp; un kenshin qui ressemble a une cordelie qui ressemble a une emotion. hooray ~
7669,"je ne peux pas me souvenir de mon mot de passe pour bebo.com/x_vivaglam, donc c'est la fin de ca"
7823,et twitter suce avec ces choses de compte de mots. anywho et je ne peux pas entrer sur yahoo ... ca ne m'a pas laisse tomber
7970,"assembler la moto / la poussette de mayah. maintenant, nous allons trouver un casque pour elle et aller de la"
8100,se sent mentalement et emotionnellement draine ryt maintenant
8169,qu'en est-il des elements urbains dans un monde fantastique? orcs conduisant des motos
8239,"juste en passant par 2 soulignent chaque mot de votre & amp; les derniers tweets ont 2 disparus pendant un certain temps. - bis spater, susanne"
8323,"suivez-lui, il a des tweets avec de vrais mots de sagesse ... il ne fait toujours que 2 dire wsup 2 toutes ses amies. n'allez-vous pas?"
8352,"je dois avoir ce mot comme ""mot du jour"" un jour."
8730,"malheureusement, aucune rumeur. le promoteur l'a confirme, deja des informations sur la facon d'obtenir des remboursements et j'ai attire des lieux confirmes annules"
8866,"dommage, nous sommes tous tres emotifs en ce moment impliquant nin ... il est probable que je laisse un peu de l'autre au spectacle pa."
8902,oh noele .. huntsmans sont au-dela de n'importe quel mot horrible effrayant ... je les deteste ... ils me font peur! & amp; theyre freakin big fuckers !!!
9057,& amp; (desole de dire) un meilleur 4eme album ... c'est mauvais! l'artiste est l'inde. elle a besoin de plus d'airplay et de meilleure promotion !!!
9259,"ouais, je veux dire, nous passons des minutes avec mika et des heures / jours avec le mfc. il est beaucoup plus emotif de leur dire au revoir."
9416,merci d'avoir diffuse le mot et du twittage sur notre concours!
9481,"se retrouve aussi! et le rapport de la piste, pas de douches, ne pas utiliser ce mot de quatre lettres..lol"
9719,"mots je trouve amusant 2 dis: groovy, ping-pong, caca, beurre corporel, kangourou, batard, yo, panda, automobile, butin, asphalte et amp; moule de sauce."
9807,"content que vous soyez d'accord qui me derangerait aussi, ils utilisent toujours ce mot lol?"
9830,"non, vous n'avez pas besoin d'un nom d'utilisateur ou d'un mot de passe pour acceder ... je fais mon emission live gratuitement jusqu'a present ..."
9976,je deteste quand mes amis savent exactement ce qui ne va pas sans que je le dise. conduit a des choses emotionnelles tres lourdes
10002,"ne sais-tu pas? la trahison est le nouveau noir! hey, ca fera un bon t-shirt! sauf, je ne peux pas utiliser le mot noir"
10058,"6h45 debut. rendez-vous a l'hopital. la meteo semble etre detergente, c'est un mot vraiment difficile a epeler. veuillez corriger si incorrect"
10393,quel est le mot de l'image entiere? fermez les yeux et ouvrez mon esprit
10763,j'ai juste reserve ma consultation pour l'emotion bresilienne!
10916,"coude, motifs de divorce. une excellente chanson qui."
11040,"merci haha, je vais le melanger la premiere semaine et je vais de la, je pense. je m'attends aussi a un mot de vocabulaire de la journee."
11043,"desole, je ne sais pas le mot pour le barbecue"
11079,"se preparer 2 l'appeler une nuit. aujourd'hui etait tres emotif et avait besoin d'un appel a l'action, donc le barrage de mise a jour avait une bonne nuit d'amis!"
11415,bien. le mot de passe est le meme?
11978,"sur la route de la suisse ""motorista eh um kamikaze !!! & quot;"
12082,enfer oui moi aussi! 'fuck them fausser cul promoteurs !! je ne pense pas pouvoir faire le 14eme
12124,"en fache, je me suis leve trop tard pour obtenir ma moto imposee au bureau de poste, bah. pourquoi le bureau de poste ne peut-il pas garder les bonnes heures?"
12143,"je me suis bien amuse sur le google & quot; day in the cloud & quot; promotion, mais j'ai eu une connexion internet et des problemes majeurs de gestion du temps."
12354,"mon mari est-ce qu'il me manque comme un fou, il est en promotion de sa musique et je ne le verrai pas 4 2 mois entiers"
12540,"la nuit la plus geniale la nuit derniere - une bonne prise de boisson avec korn, alice, rage contre la machine, w rayures, tete de moteur, slipknot est sur place"
12728,il devrait y avoir un mot pour la realisation que ce que vous pensiez etre un roman trash est vraiment plutot bon
12802,"est en train d'eliminer le contact avec des personnes qui me sucent l'ame seche! aujourd'hui, je suis libre de vampires emotionnels"
12931,"sinon, vous savez que tom greenbaum est le chef de l'operation principale. je l'ai oublie le dernier mot, j'etais fou fiere, je le savais aussi"
12968,je vais pleurer si elles annoncent le mot d!
12992,je revise pour mon examen demain ... besoin de motivation ... aw ..
13043,"clarification: lorsque j'ai utilise le mot ""bump & quot; dans un tweet, l'autre jour, je parlais de jouer de la musique a haute voix avec la basse"
13114,"heureux d'avoir un jour de conge complet, je passe une journee de formation de maitre le jeudi avec l'imi (institut de l'industrie du motering), je suis cool"
13156,"n'est pas le premier mot est & quot; drew & quot; un gars de son lycee + c'est son premier album, avant d'evanouir joe"
13231,nous vous aimons plus lorsque vous dites de mauvais mots et comment etait le spectacle au chili? parce que vous les gars vous excusez beaucoup x
13258,dit (headspin) hihih cutie ng emoticon na a
13289,est extremement demotive aujourd'hui
13299,"& quot; si notre client suppotraffic est une indication, django est tres populaire aupres des developpeurs professionnels de moteurs d'applications. & quot; pythone"
13424,"ha! vous oubliez, j'ai deja votre numero crackberry! lol. avoir un sommeil tranquille rachel. ps ~ merci pour les gentils mots re: photos"
13814,"j'ai utilise chntpw pour reinitialiser mon propre mot de passe ajoute windows vm disk dans mon ubuntu vm, c'etait beaucoup plus facile alors"
14178,ne dites pas le mot f.
14238,asseyez-vous ici en esperant 2 conduire la moto plus tard
14257,"vous devriez transformer votre hobby decapant en carriere alors, comment pouvez-vous avoir de la passion sans emotion?"
14339,la vie est destinee a etre appreciee. quittez votre mothafucker en train de pleurnicher et de le vivre.
14559,luttant avec le mot ms en raison d'une mauvaise configuration
14585,"je suis juste une fille, je ne suis pas si special. vous n'avez pas besoin de dire comme ces mots. ils me rendent si triste que je ne les veux pas."
14662,"m'a frappe le lundi, je suis sur que nous pouvons nous accrocher. et l'art? euh, je ne sais pas si vous savez ce que signifie ce mot!"
14763,merci beaucoup pour le shoutout et les mots gentils concernant mon blog! tres appreciee.
14845,"alors quoi? les gens peuvent etre 2 mots? 2 nom de famille est encore il y a quelque chose comprehensible, mais deux noms - apres k?"
14980,"avoir une pause apres une longue journee de travail, puis commencer a assigner 2 pour l'un des sujets uni ... besoin d'ecrire 3000 mots au cours du week-end"
15144,j'adore les choses qu'il vend ... vous devriez aider ce gars avec son logo et acheter c'est un peu de mot
15371,quel est le mot que je recherche? frappe.
15479,"pas trop motive pour le travail aujourd'hui. puisque ce n'est pas une bonne chose, il est temps d'allumer la musique et de mieux se mesurer"
15487,vient de decouvrir que mon professeur de tafe a suspendu nos sites web - je suppose que c'etait plus facile que de changer 50 mots de passe etranges
15505,"un mot pour les filles dans de grandes lunettes de soleil: yoko. elle avait l'habitude de marcher d'enormes nuances enveloppantes. pas un look chaud. mesdames, arrete de cacher tes yeux."
15910,ecrire des lignes directrices pour l'emballage et le demenagement. la difficulte des faibles avec des mots
16009,"reinstallez yahoo sur les parametres de mon iphone? oui, toujours dire que le nom d'utilisateur ou le mot de passe est incorrect"
16030,"je ne suis pas alle ici pendant un certain temps, je ne me souvenais pas de mon mot de passe grr de toute facon, mais je suis de retour maintenant, donc ca doit etre un plus"
16390,awww etes-vous emotionnel alors ?!
16412,"mot ... les billets sont vendus dans le musee de l'air et de l'espace, je n'avais aucune idee de ce que je voulais obtenir pour tous. mais sushi n'est pas"
16735,"merde, j'ai dit le mot 'v' ...."
16940,"effectivement. jusqu'a 668 mots maintenant, devez arreter, marcher, boire de l'eau, penser, ecouter des morceaux et se diriger vers une autre reunion. j'aime ma vie"
16942,contactez-moi pour l'un des nouveaux moto les autocollants c-bus
17597,"finalement, je suis sorti sur la moto apres toute la pluie et j'avais bientot mon troisieme plat, alors n'etait pas assez fort pour relacher le levier de roue"
17688,pneumonoultramicroscopicsilicovolcano-coniosis est une maladie pulmonaire et est le mot le plus long dans le dictionnaire principal lol
17851,oh c'est horrible. a cause du grand mot r ou avez-vous fait quelque chose norti? hehe. j'espere que vous trouverez quelque chose bientot.
18205,le mot grotesque est drole
18318,"juste ne suit pas * presque * tout le monde avec les mots & quot; consultant en marketing de medias sociaux & quot; dans leur biographie. hmm, quelle chronologie svelte"
18472,dannygokey est en train de rattraper son retard! continuer a voter pour diffuser le mot!
18543,"est-ce que j'ai vraiment utilise le mot ""haine"" ? je crois que n'importe quelle entreprise dans ""communication"" devrait etre bon, certains ne le sont pas."
18852,"me rappelle votre reponse emotionnelle & quot; point (suppression de mails dans gmail), et pourquoi je desactive la reconnaissance de visage dans iphoto '09"
19323,est-ce que je peux passer a 8 000 mots d'ici le lundi? je pense que je suis a la hauteur du defi!
19329,je pense que le mot pieuvre est un aphrodisiaque
19354,"ooooooooooh cidre de marmotte! ok maintenant, je manque les etats. haha triste raison cependant, hmm."
19421,ils ont vendu le backsplash hors de nous apres nous l'avoir promis. est-ce que le lit etait bas aujourd'hui apres la semaine a vbs. fatigue & amp; sans motivation.
19508,"quelque douche vient d'entrer dans mon msn sans connaitre mon mot de passe, a l'aide d'un programme et a appele toutes les putains de mes amis et ils pensent que c'est moi"
19539,"merci d'avoir suivi, pouvez-vous diffuser le mot? je ferai de meme pour toi sans pardon xxx"
19583,2 mots oh mon cher
19722,mes mots exactement
19964,coude - motifs de divorce - geniale plaat!
20082,combien de bois pouvait un mandrin de marmotte si une marmotte pouvait pousser du bois? idk mais aujourd'hui il le ferait avec un sourire! ecureuil! twitter tourettes
20381,": lolwrong name ^^. de toute facon: j'ai trouve une liste de thtv sur dailymotion, l'ai poste sur le forum, vous voudrez peut-etre se propager par mot ???"
20572,et le mot de passe est stuf727o a nouveau
20631,ahhahah ... je ne sais meme pas si j'ai utilise correctement le mot lol ... ma competence en anglais ne fonctionne pas correctement 2 jours
20679,"j'ai utilise le mot cuss pour manque de meilleur terme. je n'ai pas assez ""maudire"" je viens d'aller super dur !!! je tente de ne pas maudire. ce n'est pas une dame comme"
20819,"chrissy vient de dire que si je meurs, elle ne pleurerait pas ... ses mots exacts & n0pe & quot; hmph."
21599,je n'ai pas commence !!! ce n'etait pas moi !!! juste twittage 3 desactiver les mots !!! je suis une mauvaise personne ... pourquoi es-tu grincheux ????
21762,oui! c'est la motivation dont j'ai besoin
21810,"wheeee! premier tirage du livre termine. 47 000 mots! c'est gentil de taper - la fin - sur elle. maintenant, pour les reecrits!"
21919,"s'il vous plait, la motivation! je dois me concentrer, travailler! allons!!"
22177,parle-moi de ca. je deteste *** moths. passionnement.
22219,desole semble etre le mot le plus difficile
22453,"je ne me suis meme pas derange cette annee, surtout sans emotion! est-ce que j'ai vraiment manque quelque chose de tres special?"
22649,je pense qu'il pourrait ne pas m'en occuper. toujours pas de mot.
22847,"j'adore le mot melancolie, donc la chanson est juste plus incroyable a cause de ca, lol"
22941,je vais suivre le mot a vos amis un adepte
23018,"encore 1400 mots a ecrire. dam, je ne peux pas attendre jusqu'a 2moro a 12. ne va pas dormir beaucoup. jaloux de tous avoir un si bon week-end"
23174,"pret pour une finale de magie de lakers ... desole mes collegues, mais je pense que mes lakers vont le prendre en 5! j'espere que je n'ai 2 pas manger mes mots!"
23252,j'ai une reponse a un mot pour vous qui dit tout: crackberry.
23708,baise est un grand mot. l'utiliser comme un verbe;) crakkin dood.
23733,je deteste utiliser le mot t mais je pense que mon petit bebe parker agit plus comme un tout-petit tous les jours ... et je suis triste
23760,merci. j'apprecie les mots gentils. je souhaite que l'audio et la video auraient ete meilleurs.
23797,"je mange quelque chose de doux ... trop mauvais dans le dictionnaire tcheque-anglais, il n'y a pas de mot comment pourrais-je l'exprimer! mais c'est vraiment bon"
23812,"heureux de l'entendre! j'ai egalement ecrit un article de 3000 mots sur fujian (specifiquement fz, xm, & amp; tulou) qui a ete imprime dans le magazine shi jie   ?   lan "
23895,je viens de voir mon petit bebe avoir une commotion cerebrale
24004,"a regarde des videos de fanwalk ... ne devrait pas vraiment faire ca, parce que je deviens tres emotif et assez nostalgique! manquer ces jours-ci"
24255,j'irais avec des chansons douces comme coldplay ou john mayer & amp; la chanson est un moyen avec des mots par un element d'action. je ne peux pas en avoir assez recemment
24341,"c'etait genial, ce gros gars qui a battu un bateau a moteur et a atterri dans l'eau juste a cote du college des rois (cambridge). maintenant a la maison cependant"
24361,"grr! motomail travaille juste deja, je veux l'appreter."
24409,des mots geniaux du sage.
24801,mot f. mes heures de vacances sucent comment diable ppl prend 2 semaines de conge quand je n'ai meme pas assez pendant 1 semaine et mes vacances etaient en novembre?
24820,mot. je manque les cours de joella.
24873,"toute la vie est une scene ... danse grande, rire fort, amour profond, jamais regretter, vivre plein. la les enfants ... vos mots de sagesse pour la journee!"
25121,"j'ai appris un nouveau mot, toujours amusant, & acretes & quot ;. un petit mot multifonctionnel, un son sinistre. que je peux utiliser"
25245,merci! haha. repandez le mot!
25430,mot! ce est ce qui se passe !! faites le moi savoir !
25437,... si fatigue. mon cerveau fait mal. & amp; je me sens vraiment emotionnel en ce moment. je dis boooooooooo ... oooo ... ooo ...
25446,"3,144 mots plus tard, c'est l'heure du coucher"
25511,je vois a7x watchin motley crue tout sauf zacky.
25526,grrr semble etre un mot de passe aujourd'hui. ne fonctionne pas. et les choses ne semblent pas bonnes en voiture sage - pas de garage local a un nemo on pourrait regarder
25644,je suis alle la-bas a la recherche d'emotions emotives a prix reduit ... il n'y en avait pas un
26050,lors de la reunion de laboratoire sur le point de presenter mon approche de la gestion de la domotique ... windows 7 + iphone
26075,& lt; / cluster emoting & gt; merci de m'avoir humilie.
26180,: surement je vais faire mon meilleur niveau pour diffuser les mots sur l'initiative!
26464,"1:13 am quand quelqu'un a poste cela. l'allongement des mots-cles de twitter est une douleur parce que tous les sites connexes, mais hackerspam suks"
26466,la premiere fois que vous les voyez vivre ... un mot genial! c'est def love haha
26999,doood ... l'eveque etait le dernier mot que je vais enregistrer sur les nouveaux venus
27028,l'equipe est au cresson motororsporanch! il y a actuellement un evenement de velo sportif qui se deroule et ca sonne genial
27053,"vraiment?? alors nous devrions le motiver par-dessus toi, plutot que dormir lol"
27285,"je pense que c'est ma semaine male apres-midi, me sentant tres fatigue, fatigue et emotif. mais il passera"
27393,"ohhhh shizzz nouveau, un moteur de skylit jus fuite! bon dieu que oui!!"
27568,c'est le nouveau moteur de recherche de microsoft (bing.com). ils veulent obtenir une part de marche de google avec elle (bonne chance ...
27732,le jogging etait une excellente facon de liberer toutes mes emotions
28058,comment allez-vous avec vos evaluations? j'ai perdu 20 000 mots. 10 000 a aller
28166,"holy crap (sans jeu de mots, vraiment), j'aime vraiment reveiller et lire vos tweets tard dans la nuit. merci d'avoir inclus nous."
28442,heure juste pour verifier si jon avait twittere. ont un mal de tete majeur pour un motif de sommeil perturbateur.
28574,a perte de mots. a decouvert qu'un vieil ami a ete tue dans une epave de voiture l'annee derniere a atlanta. tres devastateur. laisse derriere deux jeunes garcons.
28583,debauche? je ne connais pas le sens du mot! je devrai etre instruit
29138,"vient supposoweto & amp; shabaka @ rich mix le dimanche soweto kinch & amp; shabaka hutchings en 3 mots .. jazz, noir, beau. ne manquez pas"
29278,"fait la promotion de ses affaires de fetes de passion, consultez www.angelaspassion.com"
29360,: le signe # en face de n'importe quel mot en fait un 'mot-cle' ... alors des sites comme peuvent les commander 4! comme!
29760,vous etes bien avec les idees et les mots que l'on prend aussi
29834,bonjour! je suppose que nous nous sommes manques a la cuisine hier 2 fois par semaine. sidebar: qu'est-ce qu'un motel 6?
29855,"j'ai un sentiment de general tout au long de l'ickiness. pas habituellement un bon signe, si je deviens emotif, la migraine est sur le chemin"
29936,"fou n'est pas le mot ... decu, je dois attendre. mon imagination court des cercles fous; je ne peux pas attendre la saison prochaine"
30054,nous sommes obliges d'ecouter les noblesses du metal et de l'emotion? triffeh!
30321,"si vous avez arrete le mot hier hier, j'aimerais entendre vos pensees. aussi quelques etoiles dans la boutique d'applications serait sympa."
30385,je suppose qu'il a un certain charme des annees 80. je serais personnellement responsable du telephone 8 pistes motorola. j'aime beaucoup mes telephones
30627,"je vous remercie! nous le pensons vraiment! et oui, andy dooley est mon artiste de motivation prefere! j'adore son travail!"
30926,"maintenant, j'ai une legere fievre (99,3 deg f) et un nez bouffant / bouche, des douleurs disparues principalement grace a la motrine. mais deux personnes ont ete sauves aujourd'hui a l'eglise."
30980,"moi, un autre grand spectacle ce soir. si vous etes dans la colline de la chapelle, nc attrape en quelques-uns @ la grotte: 506 w franklin ... creusez-le! mot!"
31008,deteste la haine? des mots aussi forts pour quelque chose qui est evidemment un animal de compagnie jouit d'une femme folle.
31035,"ooc (maintenant, essayez de reconstruire mon histoire ... et souvenez-vous de ce que j'ai perdu lorsque le mot ms a ecrase .... (non, il n'a pas enregistre une copie non plus))"
31067,oubliez les taille-crayons ... je ne peux pas trouver ma motivation pour terminer ces notes!
31497,"trop grand. c'est frustrant. au moins ce n'etait pas trop petit. je veux dire, pouvez-vous l'alterer ???? le motif est tres sympa !!!"
31563,je ne peux pas parler ou lire korean par ordinateur uhmmmm .. je veux juste dire 3 mots & quot; je t'aime & quot; bonus 2 mots & tant quot; & lt; 3 ~~~
31737,"desole, lbyn, mais tout a commence une fois que vous avez utilise le mot <<grockles>> - pourquoi ne pas utiliser <<offensants sanglants>> comme ils font oop au nord!"
31904,"motocyclette fixee, la maison est propre, aller au lit"
32102,j'ai presque rate le bus parce que je regardais la video pour les derniers mots celebres
32324,"oui, la liqueur a eu mes emotions"
32601,yelloooo .. wakakaka ... je suis encore ... ummm .. s'adapter a cette nouvelle vie ... thx pour les mots gentils
32621,"je te deteste le mot ms, tu es un visage vaginal malin"
32694,"je suis vraiment excite de jouer avec motion (), mais je dois me laisser dormir"
33065,quelqu'un aux etats-unis n'a pas aime le spasme des mots
33097,je sais que je comprends que vous pouvez faire mon essai de 3000 mots sur la promotion de l'innovation et du changement
33151,"consensus, il y a beaucoup d'emotion dans cette chanson pour les fans; allez lire l'ocean ... niley 4eva"
33465,"je ressens votre peine, mais je peux taper au moins cette liste pour vous. chrome et safari utilisent le meme moteur de rendu."
33945,shalom est un bon mot
34076,"j'ai appris quelques mots, je peux jurer comme un marin italien ivre! les grands-parents ne pouvaient pas parler anglais."
34524,des mots immortels meme ... hehe. va effrayer consciemment plus que
34588,"toute nuit qui se termine a 5h30, tomber un bus de nuit avec le mot <<disco>> estampille sur mon front a ete formidable"
34824,"et apparemment sa moyenne, c'est pourquoi nats et j'ai besoin d'avoir des mots ..."
35182,"ooc: mot! que les rochers, monsieur * huggle-berries *"
